companyName,title,jobFunction,descriptionText,location,salary,salaryInfo/0,salaryInfo/1,seniorityLevel,postedAt,companyDescription,companyWebsite,industries,applicantsCount,link
EdPlus at Arizona State University,Associate Director of Research,"Education, Research, and Information Technology","Associate Director of Research 
Do you have a passion for research and advanced analytics that are used to make decisions? Can you successfully balance innovation with operational reliability? Do you lead with accountability for outcomes and organizational impact? Then apply today for this Associate Director of Research opportunity!
NOTE: This is not a fully remote position. Must be able to reliably commute to Scottsdale Arizona three days a week.
ASU EdPlus is a dynamic unit of Arizona State University focused on the design and scalable delivery of digital teaching and learning models to increase student success and reduce barriers to achievement in higher education. We advance the economic, social, cultural, and overall health of the local, national, and international communities served by ASU.
Action Lab is a learning laboratory at ASU that is housed inside EdPlus. As a data-driven, research-focused service organization—an impact hub—Action Lab supports ASU and EdPlus initiatives by equipping leaders with the insights and analyses they need to make informed, evidence-based decisions. Action Lab’s goal is to support ASU with data and scholarship that foster transformations within higher education. With an emphasis on online learning, our predictive and evaluative analyses support student success and persistence from curiosity to graduation. Our research is actionable and operationally oriented, and we support and coordinate with high-level university stakeholders to improve student learning, motivation, and persistence and to increase equity across the university. We are a fast-paced unit that gets stuff done, makes a difference in the lives of our ASU students to drive change, and bolsters successes grounded in data and research.
Want to know more about working at EdPlus? Click here!
We are seeking an Associate Director of Research to co-lead the research strategy and execution for Action Lab, ASU’s data-driven, research-focused service organization. Every day you will make a difference in the lives of others by shaping and advancing a rigorous, actionable, and scalable research portfolio that directly informs institutional decision-making across enrollment, persistence, student success, innovation, and emerging technologies.
As a senior strategic advisor to executive leadership, you will be accountable for measurable impact and value realization from Action Lab’s research investments. You will oversee a diverse research portfolio, define success metrics, ensure methodological rigor and reproducibility, and track adoption and return on research insights. Reporting to the Senior Director or Executive Director of Action Lab, you will ensure Action Lab’s research capabilities evolve in step with institutional strategy, scale, and complexity while remaining deeply grounded in real-world decision contexts.
Essential Duties:
Define and co-lead Action Lab’s applied research strategy across enrollment, persistence, student success, and educational innovation, ensuring alignment with EdPlus and ASU priorities.Oversee a portfolio of mixed-methods research and advanced analytics initiatives, ensuring methodological rigor, data integrity, reproducibility, and measurable institutional impact.Establish and execute existing Action Lab and ASU standards for data collection, research design, modeling, governance, and ethical data use; partner with analytics, Action Lab colleagues and other ASU teams to deliver scalable, actionable research products.Lead various analytics efforts, including portfolio management, intake, prioritization, service delivery, and lifecycle oversight, ensuring accountability for outcomes, not just outputs.Serve as a strategic advisor to senior and executive leadership, translating complex analyses into clear, actionable insights that inform planning, performance, and decision-making.Direct development of research products and staff to execute the work, KPIs, forecasting models, and performance measurement systems, co-supporting student success, operations, finance, and R&D.Lead, mentor, and develop a multidisciplinary team; oversee hiring, performance management, and professional development while fostering a culture of rigorous ethical and data-informed decision-making that is woven tightly with our analytics colleagues in Action Lab.Ensure compliance with IRB and data governance standards; represent Action Lab in cross-institutional partnerships, committees, and external engagements a guide and collaborative thought partner.Perform other duties or projects as assigned or directed.
NOTE: This is not a fully remote position. Must be able to reliably commute to Scottsdale Arizona three days a week.
Minimum Qualifications:
Bachelor's degree and seven (7) years of experience appropriate to the area of assignment/field including two (2) years managerial experience; OR, Any equivalent combination of experience and/or training from which comparable knowledge, skills and abilities have been achieved.
Desired Qualifications:
PhD in Statistics, Economics, Education Policy, Data Science, Organizational Research, Behavioral Sciences, Learning Science, or a related quantitative or interdisciplinary field.Seven to ten plus years of progressively responsible experience leading applied research and analytics functions in complex organizations (preferably higher education, edtech, or mission-driven enterprises).Demonstrated experience building and scaling an applied research or analytics organization with measurable institutional impact.Proven record of aligning research strategy to enterprise strategy and delivering actionable insights that directly influence executive decision-making.Demonstrated advanced expertise in quantitative methodologies first and foremost, including generalized linear modeling, mixed-effects models, causal inference, experimental and quasi-experimental design, structural equation modeling, and predictive analytics.Demonstrated fluency in integrating qualitative (minor skill) and quantitative (major skill) methods into cohesive, decision-ready narratives.Extensive experience using R and creating reproducible workflows.
NOTE: Please answer the following questions in your cover letter:Describe your experience using R to conduct analyses or build reproducible workflows.Applied research impact (aligned to role expectations): Provide an example of how your research or analysis directly informed a decision or action within an organization.
Salary & Benefits:
$130,000 - $140,000 per year, DOE
ASU offers a total compensation package that includes valuable employee benefits. Click here to explore options.HealthcareFinancial SecurityRetirementFamily ResourcesTuition Reduction (Eligible ASU Employee, their dependents and spouse.)Discounts
Working Environment: 
Your desk will be in the beautiful, cutting-edge, and collaborative workspace at SkySong, the ASU Scottsdale Innovation Center. The Center houses a diverse business community that links technology, research, education, and entrepreneurship to position ASU and Greater Phoenix as global leaders in the knowledge economy.
ASU EdPlus supports flexible work options, ranging from alternate work schedules to hybrid remote work schedules, subject to approvals per ASU policy. (This is NOT a fully remote position.)
Applicant must be eligible to work in the United States. ASU EdPlus will not be a sponsor for this position.
Department Statement: 
EdPlus defines itself through a culture of curiosity, risk-taking and refusing to accept the status quo. As a central enterprise unit for ASU focused on the design and scalable delivery of digital teaching and learning models to increase student success and reduce barriers to achievement in higher education, our commitments support the University charter. ASU is a national service university and aspires to accelerate positive social outcomes through the seamless integration of cutting-edge technological innovation and scalability.
EdPlus employees are valued, respected, and encouraged to be their unique selves. We know that our ability to deliver high-quality services and educational experiences is strengthened by our culture of inclusion. Our innovative approach drives outcomes through serving learners, achieving milestones, striving for excellence, solving problems, embracing urgency, and being bold.
ASU EdPlus
Apply by 11:59 pm Arizona time: Monday, April 6, 2026","Scottsdale, AZ",,,,Mid-Senior level,2026-04-01T20:25:00.000Z,"EdPlus is a focal point for blending technology with teaching and learning ecosystems, in order to achieve greater scale, more efficient delivery and better learning outcomes in traditional and nontraditional settings. This includes continuous advancement through entrepreneurial models and moving beyond the present university conception of online learning.",http://edplus.asu.edu/,"E-Learning Providers, Higher Education, and Education Administration Programs",27,https://www.linkedin.com/jobs/view/associate-director-of-research-at-edplus-at-arizona-state-university-4393042640?refId=ptem9mV3%2FzCA4VDz5OSPFw%3D%3D&trackingId=JsUnSOjeA%2FToZ2bD6TFkIQ%3D%3D&position=9&pageNum=0
ETS,"Principal, Mergers & Acquisitions",Education and Training,"About ETS

ETS is a global education and talent solutions organization enabling lifelong learners worldwide to be future-ready. For more than 75 years, we've been advancing the science of measurement to build benchmarks for fair and valid skill assessment across cultures and borders. Our worldwide impact extends through our renowned assessments including TOEFL®, TOEIC®, GRE® and Praxis® tests, serving millions of learners in more than 200 countries and territories. Through strategic acquisitions, we've expanded our global capabilities: PSI strengthens our workforce assessment solutions, while Edusoft, Kira Talent, Pipplet, Vericant, and Wheebox enhance our educational technology and assessment platforms across critical markets worldwide.

Through ETS Research Institute and ETS Solutions, we're partnering with educational institutions, governments, and organizations globally to promote skill proficiency, empower upward mobility, and unlock opportunities for everyone, everywhere. With offices and partners across Asia, Europe, the Middle East, Africa, and the Americas, we deliver nearly 50 million tests annually. Join us in our journey of measuring progress to power human progress worldwide.

The Principal, Mergers & Acquisitions will provide support across the business enterprise in M&A, strategy, competitive analysis, financial planning, and project management. The position will be part of the Corporate Development team and will work with Strategic Business Unit (SBU) leadership and Finance to develop, support, and execute strategies and actions that enhance growth opportunities and ensure long-term sustainable competitive advantage for the company and its business units. The successful individual will have a key role in all aspects of M&A, including deal sourcing, due diligence, structuring, negotiations, legal documentation, transaction closing, and post-transaction integration. Activities will include acquisitions, mergers, and divestitures, both domestic USA and international.

Responsibilities

Source M&A deal flow and generate new leads based upon corporate strategy or identify new marketsDevelop and manage relationships with outside parties (investment banks, industry consultants, potential counter-parties etc.)Evaluate strategic opportunities and make recommendations to senior management concerning tactical plans/strategies (including risks) to implement new business growth activitiesLead and manage the M&A deal processes (market analysis, prospecting, deal sourcing, due diligence negotiations, legal documentation, financial modeling, financial advisory and valuation of strategic alternatives, risk assessment, scenario analyses, etc), including deal execution, transaction closing and post-merger business integrationTrack business trends & market research, track key industry players, identify new market opportunities and lead thesis/strategy definition, help develop/track metrics for assessment of growth opportunities.Mentor, supervise, lead and manage team of associates and junior staffAdhere to ethical standards and comply with the laws and regulations applicable to your job functionBachelor's degree in Business or Engineering or Science or any relevant quantitative subjectMBA or graduate degree preferred5+ years of experience in one or more of the following: investment banking, corporate M&A/business development, financial advisory, strategic advisory, private equity, or venture capital is requiredExperience managing and transacting M&A deals strongly requiredTransactional experience, including (i) sell-side and buy-side M&A, debt and equity financing, and strategic advisory; (ii) negotiating commercial deals; (iii) valuation & return on investment (ROI)Strong interpersonal skills (written and verbal); Ability to manage conflicting deadlines; Critical thinker but with sense of urgency and bias for action; Strong convictions & emotional intelligenceAbility to critically analyze and process high volumes of information and adapt to changing demands all while managing priorities; Good listener who can glean value from differing viewpointsEffective presentation abilities; strong analytical and evaluation skillset; ability to process differing ambiguous data and synthesize value metrics; Comfort with uncertaintyStrong understanding of financial analysis and modeling and innovative problem-solving mentalityDeep and growing professional network of business relationships to support deal sourcingGood knowledge of business contracts and experience working with legal and finance professionalsCommitment to team-based environment and capable of working within cross-functional/multi-functional matrix organization; Ability to mentor, lead and manage diverse cross-functional teamsProven ability to manage priorities and maintain integrity in fast-paced challenging environmentStrong credibility, candor and good ability to speak directly even when posing dissenting viewpointAbility to be adaptable and manage competing responsibilities and deadlinesStrong communication, interpersonal and networking skills; ability to write and present effectively, instill trust and drive engagementKnowledge of EdTech ecosystem/Education market preferred but not requiredStrong proficiency in MS Office business applications (PowerPoint, Excel, Word etc)

ETS is mission driven and action oriented

We are passionate about hiring innovative thinkers who believe in the promise of education and lifelong learning.We are energized by cultivating growth, innovation, and continuous transformation for the next generation of rising professionals as leaders. Â In support of this ETS offers multiple Business Resource Groups (BRG) for you to learn and advance your career growth!As a not-for-profit organization we will encourage you to lean in to your passion for volunteering. Â At ETS you may qualify for up to an additional 8 hours of PTO for volunteer work on causes that are important to you!The base salary range advertised represents the low and high end of the anticipated salary range for this position. The base pay actually offered will take into account internal equity and also may vary depending on the candidate's geographic region, job-related knowledge, skills, and experience among other factors. The base pay is only one aspect of the Total Rewards Package that will be offered to the successful candidate.

 ETS is an Equal Opportunity Employer. We are committed to providing equal employment opportunities to all employees and applicants for employment without regard to race, color, religion, sex, national origin, age, disability, marital status, veteran status, sexual orientation, gender identity, or any other characteristic protected by law. We believe in creating a work environment where all individuals are treated with respect and dignity.","Princeton, NJ",,,,Director,2026-03-31T09:23:16.000Z,"ETS is a global education and talent solutions organization, enabling lifelong learners to be future ready. We advance the science of measurement to build the benchmarks for fair and valid skill assessment. We are committed to powering human progress by promoting skill proficiency, empowering upward mobility, and unlocking more opportunities for everyone, everywhere.

For more than 75 years, we have developed products and services based on rigorous research and our belief in the power of learning. Our portfolio consists of some of the world’s most trusted assessments - including the TOEFL® and TOEIC® exams, the GRE® and the Praxis® family of assessments - along with research, development and innovation that explores new frontiers in learning and measurement. 

Our educational measurement solutions and research contribute to the development of new methods and tools, inform important dialogue with education policymakers, and shed light on critical issues and potential solutions - all with the aim of creating a world where all learners are able to improve their lives through education.

Visit www.ets.org to learn more.",http://www.ets.org,Education Administration Programs,85,https://www.linkedin.com/jobs/view/principal-mergers-acquisitions-at-ets-4383318986?refId=ptem9mV3%2FzCA4VDz5OSPFw%3D%3D&trackingId=9wozQ25xnpsV4elIg8BrpA%3D%3D&position=6&pageNum=0
