companyName,title,jobFunction,descriptionText,location,salary,salaryInfo/0,salaryInfo/1,seniorityLevel,postedAt,companyDescription,companyWebsite,industries,applicantsCount,link
The Bolton Group,Revenue and KPI Reporting Manager,Finance and Accounting/Auditing,"Revenue and KPI Reporting Manager (Individual Contributor Role)---100% Remote (CDT or EDT Time Zones)

Our client is a fast-growing technology enabled healthcare company growing very rapidly. We are looking for a dynamic business leader who can help our client with Revenue and KPI Reporting. This role will be 100% remote, with occasional travel to the company’s corporate office for collaboration, team meetings, and corporate events. We are looking for candidates who are self-starters, comfortable working remotely, and can flourish in a very fast-paced, unstructured, and evolving work environment.
The ideal candidate will come from global technology companies and will have experience working with very large data sets.
Our client is offering $130K to $140K plus bonus and outstanding employee benefits (including 3 weeks of PTO in your first year). Our client is unable to sponsor visa’s at this time.

Core Competencies:Exceptional analytical rigor and structured problem-solvingAbility to synthesize large data sets into actionable business insightsStrong executive communication skills with the ability to present complex analyses clearlyHigh attention to detail and commitment to data accuracy and governanceAbility to operate independently in ambiguous, high-growth environments
 Primary ResponsibilitiesRevenue & Pricing Analytics:Develop and maintain advanced revenue models incorporating price-volume-mix analysis, margin decomposition, and cohort-based customer analyticsBuild scenario-based pricing models and elasticity analyses to evaluate competitive positioning and profitability impactsSupport deal-level analytics including contribution margin modeling and customer lifetime value (CLV) analysisBuild driver-based revenue forecasts leveraging historical trends, pipeline data, and predictive indicatorsPartner with FP&A on integrated forecasting models (revenue, margin, cash flow)
KPI Architecture & Business Intelligence:Design and standardize enterprise KPI frameworks aligned to revenue growth, margin expansion, and cash flow performanceDefine and operationalize metrics across customer segments, channels, and geographiesEstablish governance for KPI definitions, calculation methodologies, and reporting consistencyDevelop automated executive dashboards and self-service reporting solutionsCollaborate with Data Engineering to design scalable data models supporting revenue and KPI reportingCreate SQL queries to extract, transform, and analyze large data sets
Other Strategic Contributions:Provide executive-ready insights that translate analytical findings into clear commercial recommendationsPartner cross-functionally with Revenue Operations, Sales, Marketing, Product, and Finance to align reporting and analytical prioritiesSupport strategic initiatives including pricing optimization, capital planning, and potential M&A analysis through advanced financial modelingContribute to continuous improvement of data architecture, reporting processes, and analytical methodologies
Technical Skills & Specialized KnowledgeAdvanced Excel modeling (Power Query, Power Pivot, DAX, VBA/macros)Strong SQL proficiency (complex joins, aggregations, data cleaning)Experience with BI tools such as Power BI, Tableau, Looker, or similarExperience with ERP, planning systems, and financial data environmentsKnowledge of statistical analysis, regression modeling, or forecasting techniques preferredExperience with Python or R for financial or statistical analysis is a plus
Required QualificationsBachelor’s Degree in Finance, Economics, Data Analytics, Statistics, Mathematics, Engineering, or related quantitative field3 to 5 years of progressive experience in revenue analytics, BI, FP&A, pricing analytics, or data-driven finance rolesExperience working with large datasets and building scalable reporting solutionsExperience supporting executive leadership with data-driven insights
Preferred QualificationsAdvanced degree (MBA, MS in Analytics, Statistics, or similar) is preferredExperience in a fast-paced, high-growth environment.Familiarity with capital markets and experience in managing debt financings.Experience in financial evaluation of mergers and acquisitions.",United States,,,,Mid-Senior level,2026-03-30T21:59:24.000Z,"The Bolton Group is a professional search firm specializing in the areas of Accounting, Finance, and Audit.  Founded in 1997 in Atlanta, GA, our firm is recognized as one of the leading finance and accounting search firms serving the Southeast and Midwest, and West Coast markets.  Our diverse and growing team of recruiters offer our clients and candidates both direct hire and contract placement search services.  
 
Want to work with us? Email info@boltongroup.com",http://www.boltongroup.com,Hospitals and Health Care,200,https://www.linkedin.com/jobs/view/revenue-and-kpi-reporting-manager-at-the-bolton-group-4392104896?refId=dfRhl%2BfRVG8H2lqlmbj29g%3D%3D&trackingId=hoJrmYk55AY4lmzQylFxuw%3D%3D&position=21&pageNum=0
CodePath,"Senior Product Manager, Enterprise",Product Management and Marketing,"CodePath is reprogramming higher education to create the first generation of AI-native engineers, CTOs, and founders.

We deliver industry-vetted courses and career support centered on the needs of first-generation and low-income students. Our students train with senior engineers, intern at top companies, and rise together to become the tech leaders of tomorrow.

With over 40,000 students and alumni from 1,000 colleges now working at 4,050 companies, we are reshaping the tech workforce and the industries of the future. CodePath is supported by Amazon, Andreessen Horowitz, Anthropic, Comcast, Google, JP Morgan Chase, Knight Foundation, Meta, New Profit, Salesforce, and The Studio at Blue Meridian Partners, among others.

About The Role

Location: Remote, United States

Role Type: Full-Time

Reporting to: Chief Product Officer

Total Compensation: $200,000 - $232,000

Base salary: $135,000 - $175,000Total compensation includes the base salary plus a guaranteed monthly supplement 

Workforce upskilling is under pressure to adapt to an AI-native workforce. Companies are trying to retrain entire departments for a rapidly evolving job market, corporate L&D budgets are growing, and most providers lack the depth and rigor to prove ROI on corporate training.

CodePath has spent a decade proving that intensive, industry-validated training produces engineers who can consistently perform at top tech companies. This role will adapt that model to serve the enterprise market through new and innovative product offerings.

As a Senior Product Manager, Enterprise, you will build the enterprise product from the ground up, defining what we sell, how it's delivered, and how we measure its effectiveness. You will work directly with our Earned Revenue (Sales), Curriculum, and Engineering teams to understand enterprise partners' needs and ship solutions that empower their workforce. It's a 0 to 1 role with a direct line to revenue and a real chance to shape how CodePath scales over the next decade.

We are looking for a skilled PM with experience building and shipping enterprise products, using AI effectively in their workflow, and is energized by a bold vision to retrain the technical workforce to succeed in the era of AI.

Key Activities

Define and own the enterprise product roadmap, translating partner needs, revenue goals, and learner outcomes into clear priorities Run structured discovery with enterprise partners and internal stakeholders; define success metrics and translate them into effective product requirements, prototypes, and shipped features Design experiments to validate product bets, using qualitative signals from partners and quantitative data to make decisions and change course quickly Serve as the connective tissue between Earned Revenue, Curriculum, and Engineering, aligning on priorities, surfacing trade-offs, and unblocking progress Use AI actively in your product workflow, striving for continual improvement in quality and productivity Track and communicate progress to partners and internal teams, building the reporting rhythms that keep everyone aligned and informed 

Qualifications

Required

3+ years of product management experience, with at least 2 years building enterprise or B2B products You've taken a concept from 0 to 1, not just iterated on an existing roadmap, but built from scratch and launched a product that achieved meaningful distribution or commercial success You can structure ambiguous problems, build alignment across commercial and technical teams, and drive execution without a clear playbook You've worked closely with Sales or Customer Success to translate commercial needs into product direction, and know what a deal-blocking product gap looks like AI tools are already part of how you work, and you can describe specifically how your workflow has changed because of it Strong analytical reasoning, comfortable defining metrics that matter and interpreting data to inform product decisions You write product requirements engineers trust and can communicate product strategy clearly to technical and non-technical audiences alike 

Preferred

Experience in edtech, workforce development, or upskilling products Background working with corporate L&D, HR, or workforce benefits buyers Technical proficiency across the modern PM toolkit — product analytics (Mixpanel, Amplitude, Hex), prototyping and design (Figma), data querying (SQL), and AI-assisted development tools (Claude Code, Codex, Cursor, or similar) Experience with enterprise SaaS platforms, integrations, or admin tooling 

Compensation

CodePath has standardized salaries based on the position’s level, no matter where you live. For this role, we’re hiring for an Individual Contributor level position at an annual base salary of $135,000 to $175,000. Total compensation is $200,000 to $232,000, which includes base salary plus a guaranteed monthly supplement. Salary is determined based on your relevant experience and skills as evaluated through our interview process.

Full-Time Employee Benefits

This is a 100% remote position—work from anywhere in the U.S.! CodePath prioritizes employee well-being with a competitive benefits package to support your health, financial security, and work-life balance.

Health & Wellness: Medical, dental, and vision insurance (90% employer-covered for employees and dependents), employer-funded healthcare reimbursement, FSAs, and Employee Assistance ProgramFinancial Security: 401(k), employer-paid life & disability insurance, and identity theft protectionWork-Life Balance: Generous PTO, paid holidays, 10 weeks of fully paid parental leave, and an annual year-end company closure (Dec 24 – Jan 2)Professional Growth: $1,000 annual professional development stipend and home office setup support Student Loan Forgiveness: CodePath is a qualifying employer for Public Service Loan Forgiveness (PSLF), helping employees manage student loan debtAdditional Perks: Pet wellness plans, legal services, home/auto insurance discounts, and exclusive marketplace savings

Pay range

$200,000—$232,000 USD",United States,,,,Not Applicable,2026-04-01T15:53:13.000Z,,,"Education, Software Development, and Technical and Vocational Training",200,https://www.linkedin.com/jobs/view/senior-product-manager-enterprise-at-codepath-4382455803?refId=ptem9mV3%2FzCA4VDz5OSPFw%3D%3D&trackingId=psZN6umPMi%2F2OJj7EniYEw%3D%3D&position=10&pageNum=0
SkillUpTech,New Business Development Manager - Enterprise Sales,"Business Development, Sales, and Education","New Business Development Manager - Enterprise Sales(Commercial & Public Sector)
LOCATION: Seattle, WA (home-based office with frequent in-person meetings for team collaboration)
EMPLOYMENT TYPE: FULL-TIME
REPORTS TO: Group CEO
ABOUT SKILLUP: SkillUp is a global learning solutions company on a mission to transform how individuals and organizations learn, grow, and stay future-ready. We combine innovative technology with human-centered design to deliver deeply effective learning experiences at scale. Our portfolio spans both consumer and enterprise markets:
SkillUp Online (Consumer focused) – offering future-skills programs, including our flagship TechMaster Skilling Program, to learners worldwide.
Skill-Up Technologies – delivering enterprise solutions such as custom content development, L&D staffing, AI-enabled learning platforms, managed learning services, and compliance training. (This is where the role sits) We partner with leading enterprises, governments, and educational institutions across industries and geographies. By blending innovation with proven learning science, SkillUp empowers organizations to build the future-ready workforce they need — and empowers individuals to achieve lasting career success.
ROLE OVERVIEW: We are seeking a senior, high-impact enterprise seller to drive strategic revenue growth across the US Commercial (Enterprise & Mid-market) and Public Sector segments. This is a hands-on, quota-carrying individual contributor role focused on building and closing complex, multi-stakeholder enterprise deals. The ideal candidate thrives in consultative selling environments, understands enterprise procurement cycles, and can independently drive opportunities from prospecting through close and expansion.
This role is designed for a senior seller who builds pipeline, wins marquee accounts, and directly contributes to US market expansion.
KEY RESPONSIBILITIES:
Strategic Account Development & Revenue GenerationOwn and execute a personal revenue target across Enterprise and Public Sector segments.Identify, prospect, and develop net-new strategic accounts.Build multi-threaded relationships across executive, HR, L&D, and procurement stakeholders.Lead complex deal cycles from qualification through negotiation and close.Develop account expansion strategies to drive renewals, cross-sell, and upsell opportunities.
Enterprise & Public Sector EngagementNavigate complex procurement environments, including RFPs, compliance requirements, and federal/state/local government processes.Drive vertical penetration across priority industries including Healthcare, BFSI, Pharma, Oil & Gas, Government, and Higher Education.Position SkillUp’s portfolio of content, platform, staffing, and managed learning services as integrated enterprise solutions.
Pipeline & Forecast ManagementBuild and manage a disciplined sales pipeline using CRM tools.Apply structured sales methodologies such as MEDDIC or similar frameworks.Maintain accurate forecasting and pipeline hygiene.Leverage data insights to prioritize high-value opportunities.
Cross-Functional CollaborationPartner with Marketing to align on demand generation and campaign follow-ups.Collaborate with Product and Delivery teams to tailor solutions to enterprise requirements.Work closely with Customer Success to ensure smooth handoffs and long-term account growth.
Strategic Market ContributionProvide market intelligence and customer insights to inform product positioning and GTM strategies.Identify potential channel or partnership opportunities to accelerate market access.
QUALIFICATIONS & SKILLS:10+ years of enterprise B2B sales experience, preferably within EdTech, HR Tech, SaaS, or Learning Solutions.Proven track record of consistently meeting or exceeding enterprise revenue targets.Demonstrated success closing complex, multi-stakeholder enterprise and public sector deals.Strong understanding of US Public Sector procurement cycles and RFP processes.Experience selling into regulated or complex verticals such as Healthcare, Pharma, BFSI, or Government.Proficiency with CRM platforms and data-driven sales management.Entrepreneurial mindset with ability to operate independently in growth environments.Data-driven leader with strong command of CRM platforms and revenue analytics.International exposure desirable but not essential.
LEADERSHIP COMPETENCIES:Entrepreneurial mindset with ability to balance agility and process discipline.Strategic thinker with operational rigor, able to design systems while executing hands on.Strong change management skills to introduce new processes in high-growth settings.Collaborative, influencing leader who partners across functions and builds trust.Passionate about the future of learning and workforce transformation.
WHY JOIN SKILLUP?Direct Impact: Drive US enterprise growth through strategic deal execution.Portfolio Breadth: Represent innovative offerings spanning content, platforms, services, and future-skills programs.Growth Stage Opportunity: Help expand SkillUp’s footprint in high-value US markets.Global Mission: Contribute to shaping how organizations build future-ready workforces.
COMPENSATION: Base compensation and performance-based variable, Paid Time Off, Impressive Benefits Package, 401K.","Seattle, WA",,,"$120,000.00",Mid-Senior level,2026-04-02T22:15:03.000Z,"Skill Up Tech has the best industry products and world class certified trainers to deliver quality online/ offline courses , live training & corporate training programs! we believe in learning by doing things and all our programs are designed to give hands-on knowledge at flexible timings. We offer interactive live classes for Machine learning and AI programs, Data Analytics, Generative AI and interview preparation strategy to crack any interview. ",https://skilluptech.in/,Education,25,https://www.linkedin.com/jobs/view/new-business-development-manager-enterprise-sales-at-skilluptech-4395718616?refId=ptem9mV3%2FzCA4VDz5OSPFw%3D%3D&trackingId=1T55F2DUEUnNYUoyXJ6IYw%3D%3D&position=1&pageNum=0
