companyName,title,jobFunction,descriptionText,location,salary,salaryInfo/0,salaryInfo/1,seniorityLevel,postedAt,companyDescription,companyWebsite,industries,applicantsCount,link
Fidelity Investments,"Vice President, Branch Leader - San Francisco Bay Area",Finance and Sales,"Job Description

Vice President, Branch Leader

It's said that the key to a successful sales strategy is to sell yourself, sell your company, and sell your product. With a focus on employee development and collaboration, as the leader of a Fidelity branch team, you'll have the resources at your disposal to succeed on each count.

The Expertise We’re Looking For

We ask that you have at least five years in financial sales roleWe believe that three or more years of management within a financial services environment is helpfulThe Series 7 and 66 or 63/65 are required, additionally we would want you to obtain the Series 9/10 upon hire

Our mission in the branch is to drive business opportunities by building a strong sales and service team that will embrace the company brand and cultivate revenue while ensuring high levels of customer happiness. By educating the local market, you will drive national initiatives and grow local business through in-branch customer meetings, informative seminars, lead utilization, and client appreciation.

The Skills You Bring

All-encompassing brokerage and mutual fund knowledge and expertise in financial planningA contagious enthusiasm for hiring, mentoring and developing new branch associatesInspired by a real passion for working collaboratively, improving productivity, and implementing ideasCoordinating and supporting cross-company partnerships and regional corporate relationships that lead to business opportunitiesPositive attitude, empowering business professionalism and strong work ethic with high level of integrity

Note: Fidelity is not providing immigration sponsorship for this position

The Value You Deliver

You are a key leader in the Investor Center and beyond. As someone who leads, recruits, and works closely with branch employees, team building is something you take seriously. You develop sales capabilities through dedicated mentoring and coaching. You are an integral figure in running branch infrastructure, including lobby and operational technology, back office processing, and quality assurance processes.

How Your Work Impacts the Organization

You will function as a general manager for the branch, building and leading strategies to develop your associates and their business. Your leadership and decisions will have significant impact on branch success, market growth and profitability.

Company Overview

Our mission at Fidelity is to make our financial expertise broadly accessible and effective in helping people live the lives they want. We are a privately held company that places a high degree of value in creating and nurturing a work environment that attracts the best talent and reflects our commitment to our associates. For information about working at Fidelity, visit FidelityCareers.com

Fidelity Investments is an equal opportunity employer.

The base salary range for this position is $115,000 - $170,000 per year.

Placement in the range will vary based on job responsibilities and scope, geographic location, candidate’s relevant experience, and other factors.

Base salary is only part of the total compensation package. Depending on the position and eligibility requirements, the offer package may also include bonus or other variable compensation.

We offer a wide range of benefits to meet your evolving needs and help you live your best life at work and at home. These benefits include comprehensive health care coverage and emotional well-being support, market-leading retirement, generous paid time off and parental leave, charitable giving employee match program, and educational assistance including student loan repayment, tuition reimbursement, and learning resources to develop your career. Note, the application window closes when the position is filled or unposted.

Most roles at Fidelity are Hybrid, requiring associates to work onsite every other week (all business days, M-F) in a Fidelity office. This does not apply to Remote or fully Onsite roles. Some roles may have unique onsite requirements. Please consult with your recruiter for the specific expectations for this position.

Please be advised that Fidelity’s business is governed by the provisions of the Securities Exchange Act of 1934, the Investment Advisers Act of 1940, the Investment Company Act of 1940, ERISA, numerous state laws governing securities, investment and retirement-related financial activities and the rules and regulations of numerous self-regulatory organizations, including FINRA, among others. Those laws and regulations may restrict Fidelity from hiring and/or associating with individuals with certain Criminal Histories.

Certifications

Series 07 - FINRA, Series 09 - FINRA, Series 10 - FINRA, Series 66 - FINRA

Category

Sales","Burlingame, CA",,,,Executive,2026-03-31T17:54:55.000Z,"Fidelity’s mission is to strengthen the financial well-being of our customers and deliver better outcomes for the clients and businesses we serve. Fidelity’s strength comes from the scale of our diversified, market-leading financial services businesses that serve individuals, families, employers, wealth management firms, and institutions. With assets under administration of $15.0 trillion, including discretionary assets of $5.9 trillion as of March 31, 2025, we focus on meeting the unique needs of a broad and growing customer base. Privately held for 78 years, Fidelity employs more than 77,000 associates across the United States, Ireland, and India. 
 
For our Terms and Conditions, please visit http://go.fidelity.com/LIterms",http://www.fidelity.com,Financial Services,29,https://www.linkedin.com/jobs/view/vice-president-branch-leader-san-francisco-bay-area-at-fidelity-investments-4269813136?refId=ur1YwNJCuAa%2FRqkBsijq6g%3D%3D&trackingId=SFAFQRMk80U%2BiJfSHCXftQ%3D%3D&position=25&pageNum=0
Robert Half,"Senior Accountant | PE backed EdTech | NYC, 2 days in office","Finance, Accounting/Auditing, and Other","If you’re a strong accountant and still being kept in a lane, read this.
If your role feels like close, repeat, wait for direction… you’re being underutilized.
This is not that.
Senior Accountant | PE backed EdTech | NYC | $100 to $120K + bonusHybrid 2 to 3 days in Chelsea. You pick your days. • Work directly with CFO and Director of Accounting • Second accounting hire at the company • ~$30M ARR growing ~18% YoY • Backed by top VC
Why this is different.• There is no playbook sitting on a shelf, you help build it • You see the full picture, close, revenue, audit, and how the business actually runs • Systems are evolving, you will be part of the NetSuite transition • Small team, high expectations, your work is visible immediately
Who this is for.• 2 to 5 years experience Big 4, top national firm, or strong startup or SaaS • CPA or parts passed required • Someone who wants to be pushed, not protected
Apply here & email your resume to alex.muzaurieta@roberthalf.com
Most people will read this and move on.
 The right person will not.","New York, NY",,,,Associate,2026-04-03T21:08:00.000Z,"🔒 At Robert Half, we prioritize your security—if you believe you've encountered a scam or fraudulent recruiter, please report it immediately to https://www.roberthalf.com/us/en/fraud-alert. All Robert Half recruiters communicate using their corporate email address, ending in roberthalf.com. 

👋 Welcome to Robert Half. We're the world’s first and largest specialized talent solutions firm, connecting opportunities at great companies with highly skilled job seekers. We provide dynamic contract, temporary, and permanent executive placement solutions across finance, accounting, technology, marketing, creative, legal, and administrative sectors.

🏆 In the last 12 months, Robert Half has been recognized as one of America’s Most Innovative Companies by Fortune, and with Protiviti, has been named one of the Fortune® World's Most Admired Companies™ and 100 Best Companies to Work For.

🏦 Traded on the New York Stock Exchange (symbol: RHI), we’re at the forefront of innovation in talent acquisition.",https://www.roberthalf.com,"Restaurants, Financial Services, and Accounting",25,https://www.linkedin.com/jobs/view/senior-accountant-pe-backed-edtech-nyc-2-days-in-office-at-robert-half-4397374221?refId=C0SgkYC03pvH8P19KZf%2F1A%3D%3D&trackingId=WurCRXRwJUpwHgfXUvJ33A%3D%3D&position=11&pageNum=0
VIVO Agency,Director of Strategy - Healthcare/Pharma Marketing,"Marketing, Advertising, and Strategy/Planning","About UsWe’re an independent creative agency that helps healthcare’s biggest game changers connect with HCPs, patients, and consumers. From breakthrough campaigns to high-impact sales enablement, our smart, strategic teams do more than “get it done.” We uncover the path to success — and inspire our clients to walk it with us.
About YouVIVO is seeking a Director of Strategy who brings curiosity, clarity, and conviction to every challenge. If you’re ready to shape markets, inspire great work, and guide teams with a mix of rigor and heart — this is your place!You’re a natural problem-solver, translating healthcare complexity into actionable direction. You’re energized by learning new categories, asking sharp questions, and helping clients get to the truth of what their audiences need. You’re as comfortable diagnosing a business challenge as you are inspiring a room during a pitch. You know how to build trust — with clients, with creatives, and with cross-functional partners. You balance confidence with humility and gratitude, and you believe the best ideas come from teams that collaborate openly and treat each other with respect. You care deeply about craft, but even more about impact. You thrive in an agency that values initiative over ego, progress over perfection, and inclusion, integrity, and curiosity above all.
What You’ll DoAdvise clients for brands reaching consumer and HCP audiences, helping them navigate complex categoriesTranslate business challenges into clear hypotheses, strategic options, and a winning path forwardPartner closely with client services and creative to develop work that shifts perceptions and market shareIdentify and cultivate opportunities to help clients achieve their goalsBecome an expert in designated medical specialities/categories and grow the firm’s collective knowledge Bring data fluency to analyzing opportunities, developing goals, and measuring successAdvance the strategy discipline by contributing to our toolset, processes, and ways of thinkingBe a culture carrier: live the VIVO Core Values, promote inclusion and equity, celebrate great work, and support your teammates generously
What You Bring7+ years of experience in marketing/creative strategy, with 3+ years in healthcare verticals2+ years strategically leading work at a marketing/creative agency (client presentation, writing creative briefs)Experience launching medical products and/or working with healthcare providersDemonstrated ability to advise clients — identifying options and helping them commit to a directionExperience analyzing categories — market sizing/growth, company and competitive assessmentExperience leading market research — like IDIs, focus groups, surveys, and synthesizingExceptional communication skills — written, verbal, and visual — with the ability to simplify complexityProficiency with tools like G Suite, Slack, Zoom, and common research platformsWillingness to travel occasionally for client and agency meetings (up to ~25%)
Inclusion @ VIVOAt VIVO, we believe bold ideas make game-changing health innovation accessible to all. Therefore, inclusion and equality aren’t just values — they’re our advantage. We believe stronger ideas come from a mix of perspectives, and we’re dedicated to creating a space where everyone feels empowered to bring their authentic selves to work.
Search Firm Representatives Please Read Carefully: VIVO Agency does not accept unsolicited assistance from search firms for employment opportunities. All CVs / resumes submitted by search firms to any employee at our company without a valid written search agreement in place for this position will be deemed the sole property of our company. No fee will be paid in the event a candidate is hired by our company as a result of an agency referral where no pre-existing agreement is in place. Where agency agreements are in place, introductions are position-specific. Please, no phone calls or emails.",United States,,,,Mid-Senior level,2026-04-02T01:17:11.000Z,"We help healthcare innovators turn complex challenges into market-shaping opportunities—whether it’s launching a first-of-its-kind product, repositioning a brand, or unlocking stalled sales.

Our expertise:
• Brand Strategy – Be inspiring and distinct
• Market Shaping – Build a future only you can own
• Product Launches – Sell the problem first
• Sales Optimization – Make what works work harder

We partner with teams ready to challenge the status quo.

Trusted by Solventum, Nutricia, Johnson & Johnson, GE Healthcare, Real Food Blends, and more.

Explore VIVO Pro for insights, tools, and research built for health marketers who want to make their difference matter.",http://www.vivoagency.com,Strategic Management Services and Marketing Services,183,https://www.linkedin.com/jobs/view/director-of-strategy-healthcare-pharma-marketing-at-vivo-agency-4395215522?refId=DwHaMgnKpjycUEhCdIjrFQ%3D%3D&trackingId=YIbtxIwuM7QF6oLXKY0ICw%3D%3D&position=25&pageNum=0
Cypress HCM,"Senior Director Business Development, Mobile & Satellite Networks",Business Development and Sales,"Senior Director Business Development, Mobile & Satellite NetworksLocation: Dallas/Reston/Santa Clara (prefer local to office; open to considering remote w/ travel)Employees: ~100Industry: TelecommunicationsReports To: CEO
Seeking a Senior Director Business Development, Mobile & Satellite Networks who is highly experienced and networked to drive commercial growth for advanced Position, Navagation, and Timing (PNT) solutions across global telecom ecosystems. This position will establish and scale strategic partners with high-priority MNO, SNOs, and adjacent connectivity providers.
The ideal candidate will bring deep expertise within the telecom and satellite landscape, a strong executive presence, and a demonstrated ability to structure and close complex partnerships involving network integration, spectrum strategy and mission-critical services.
Most Important Responsibilities:Define and execute partnerships strategies with MNOs, SNOs, and other operator segments to accelerate adoption of advanced PNT and location-based capabilities.Responsible for major MNO/SNO targets and requires consistent ownership to build sustained technical and commercial relationships within major accounts.Drive awareness and interest in PNT solutions and identify fit across MNOs.Build and maintain senior-level relationships across operator organizations, aligning technical, commercial, and strategic priorities.Lead end-to-end deal execution, including opportunity sourcing, business case development, negotiation, and commercialization frameworks for operator-integrated solutions.Articulate the value of 3D positioning and timing technologies to executive, technical, and product stakeholders within operator environments.Drive technical discussions with operator engineering teams, translating network and deployment requirements into product and roadmap inputs.
What you can bring to the table to impact this role, team, and organization:10+ years of experience in enterprise business development, strategic partnerships, or leadership roles within MNOs wireless, satellite, or network infrastructure sectors.Deep network and established relationships within MNO and enterprise telecom.Familiarity with NTN/LEO satellite operations is highly preferred.Proven experience of navigating large telco organizations to reach network, product, and policy teams and structuring commercial partnership frameworks (LOIs, pilot agreements, MoUs).Understanding of 3GPP, 5G Network location services and E911/E-PSAP compliance landscapes strongly preferred.Strong executive communication and comfortability presenting to senior leadership at major MNO companies.Experience managing cross-functional initiatives spanning technical, commercial, and regulatory domains.Executive presence with the ability to engage operators, OEMs, government entities, and investors.Familiarity with 5G, non-terrestrial networks (NTN), network architecture, spectrum strategy, and/or location-based services.Exposure to positioning, navigation, and timing (PNT) technologies preferred.
Compensation: $200 - $233k+ plus 20-30% bonus and equity",United States,,,,Director,2026-04-01T14:30:04.000Z,"At Cypress, we deliver top talent to your doorstep. Our nationwide reach and industry expertise help us precision-match candidates, saving you time and frustration. Our experts specialize in placing highly qualified employees, ensuring a perfect fit that not only boosts individual career paths but also enhances organizational productivity.  ",https://www.cypresshcm.com,Telecommunications,69,https://www.linkedin.com/jobs/view/senior-director-business-development-mobile-satellite-networks-at-cypress-hcm-4392886817?refId=DwHaMgnKpjycUEhCdIjrFQ%3D%3D&trackingId=z%2FpdKrrcwb%2F4PrK84UrRsw%3D%3D&position=24&pageNum=0
The Bolton Group,Revenue and KPI Reporting Manager,Finance and Accounting/Auditing,"Revenue and KPI Reporting Manager (Individual Contributor Role)---100% Remote (CDT or EDT Time Zones)

Our client is a fast-growing technology enabled healthcare company growing very rapidly. We are looking for a dynamic business leader who can help our client with Revenue and KPI Reporting. This role will be 100% remote, with occasional travel to the company’s corporate office for collaboration, team meetings, and corporate events. We are looking for candidates who are self-starters, comfortable working remotely, and can flourish in a very fast-paced, unstructured, and evolving work environment.
The ideal candidate will come from global technology companies and will have experience working with very large data sets.
Our client is offering $130K to $140K plus bonus and outstanding employee benefits (including 3 weeks of PTO in your first year). Our client is unable to sponsor visa’s at this time.

Core Competencies:Exceptional analytical rigor and structured problem-solvingAbility to synthesize large data sets into actionable business insightsStrong executive communication skills with the ability to present complex analyses clearlyHigh attention to detail and commitment to data accuracy and governanceAbility to operate independently in ambiguous, high-growth environments
 Primary ResponsibilitiesRevenue & Pricing Analytics:Develop and maintain advanced revenue models incorporating price-volume-mix analysis, margin decomposition, and cohort-based customer analyticsBuild scenario-based pricing models and elasticity analyses to evaluate competitive positioning and profitability impactsSupport deal-level analytics including contribution margin modeling and customer lifetime value (CLV) analysisBuild driver-based revenue forecasts leveraging historical trends, pipeline data, and predictive indicatorsPartner with FP&A on integrated forecasting models (revenue, margin, cash flow)
KPI Architecture & Business Intelligence:Design and standardize enterprise KPI frameworks aligned to revenue growth, margin expansion, and cash flow performanceDefine and operationalize metrics across customer segments, channels, and geographiesEstablish governance for KPI definitions, calculation methodologies, and reporting consistencyDevelop automated executive dashboards and self-service reporting solutionsCollaborate with Data Engineering to design scalable data models supporting revenue and KPI reportingCreate SQL queries to extract, transform, and analyze large data sets
Other Strategic Contributions:Provide executive-ready insights that translate analytical findings into clear commercial recommendationsPartner cross-functionally with Revenue Operations, Sales, Marketing, Product, and Finance to align reporting and analytical prioritiesSupport strategic initiatives including pricing optimization, capital planning, and potential M&A analysis through advanced financial modelingContribute to continuous improvement of data architecture, reporting processes, and analytical methodologies
Technical Skills & Specialized KnowledgeAdvanced Excel modeling (Power Query, Power Pivot, DAX, VBA/macros)Strong SQL proficiency (complex joins, aggregations, data cleaning)Experience with BI tools such as Power BI, Tableau, Looker, or similarExperience with ERP, planning systems, and financial data environmentsKnowledge of statistical analysis, regression modeling, or forecasting techniques preferredExperience with Python or R for financial or statistical analysis is a plus
Required QualificationsBachelor’s Degree in Finance, Economics, Data Analytics, Statistics, Mathematics, Engineering, or related quantitative field3 to 5 years of progressive experience in revenue analytics, BI, FP&A, pricing analytics, or data-driven finance rolesExperience working with large datasets and building scalable reporting solutionsExperience supporting executive leadership with data-driven insights
Preferred QualificationsAdvanced degree (MBA, MS in Analytics, Statistics, or similar) is preferredExperience in a fast-paced, high-growth environment.Familiarity with capital markets and experience in managing debt financings.Experience in financial evaluation of mergers and acquisitions.",United States,,,,Mid-Senior level,2026-03-30T21:59:24.000Z,"The Bolton Group is a professional search firm specializing in the areas of Accounting, Finance, and Audit.  Founded in 1997 in Atlanta, GA, our firm is recognized as one of the leading finance and accounting search firms serving the Southeast and Midwest, and West Coast markets.  Our diverse and growing team of recruiters offer our clients and candidates both direct hire and contract placement search services.  
 
Want to work with us? Email info@boltongroup.com",http://www.boltongroup.com,Hospitals and Health Care,200,https://www.linkedin.com/jobs/view/revenue-and-kpi-reporting-manager-at-the-bolton-group-4392104896?refId=DwHaMgnKpjycUEhCdIjrFQ%3D%3D&trackingId=HmU90O%2BLFh6AGUvyOiT%2FFw%3D%3D&position=21&pageNum=0
